"ConstituentID","TextType","BioDsp","PrimaryBio"
"266","Artist Biography","<p>Paul Wayland Bartlett was born in NewHaven, Connecticut, in 1865, the son of the minor sculptor Truman Howe Bartlett. When Bartlett was nine years old, theBartlett family moved to France. Bartlett studied art at the &Eacute;cole des Beaux-Arts in Paris, where he developed an affinity for sculpting animals. His <i>Bear Tamer</i> received an honorable mention at the Salon in Paris in1887; <i>Indian Ghost Dancer</i> was admired for its exacting anatomy at the World's Columbian Exposition in Chicago in 1893. Bartlett became one of the prominent Beaux-Arts artists of his day, maintaining sculpture studios in Paris, New York, and Washington, D.C. Major examples of his work include the equestrian statue of the Marquis de Lafayette (1899&ndash;1908), donated by the United States to France, and the west wing of the U.S. Capitol. The artist died in Paris in 1925.</p><p><i>National Museum of American Art</i> (CD-ROM) (New York and Washington D.C.: MacMillan Digital in cooperation with the National Museum of American Art, 1996)</p>",""
"266","Artist Biography","<p>Sculptor. Son of the minor sculptor Truman Howe Bartlett, the artist trained in France with Emmanuel Fr&#233;miet and became an eminent Beaux Arts sculptor. Well-known examples of his work are the equestrian <i>Lafayette</i> (1899&#8211;1908), donated by the United States to France, and the pediment of the west wing of the U.S. Capitol.</p><p>Joan Stahl <i>American Artists in Photographic Portraits from the Peter A. Juley & Son Collection</i> (Washington, D.C. and Mineola, New York: National Museum of American Art and Dover Publications, Inc., 1995)</p>","Primary"
"275","Artist Biography","<p>Born in New Brunswick, New Jersey, Leonard Baskin was educated at the New York University School of Applied Arts and, after a stint in the United States navy, at the New School for Social Research in New York City. Travels in Europe in 1950 and 1951 were also of vital importance to his artistic development. Since his first exhibitions in the early 1950s, Baskin has pursued an active career in illustration, design, and sculpture.</p><p>Baskin's work is represented in the collections of major museums in the United States and Europe, including the National Gallery of Art, the Victoria and Albert Museum, and the Whitney Museum of American Art. His graphic art and sculpture have been shown in exhibitions in the United States, England, France, and Austria. He is also the recipient of numerous graphic-design awards, including the Special Medal of Merit from the American Institute of Graphic Arts.</p><p>Although sculpture has remained a major part of Baskin's oeuvre, it was through graphic design that he originally gained renown. He has worked extensively with woodcuts, chiefly for book illustration. He is the founder of the Gehenna Press in Massachusetts and has been a major force in the revitalization of small American presses. Baskin's posters and other graphic art are distinguished by a consistently powerful directness in exploring the full range of form and expression.</p><p>Therese Thau Heyman <i>Posters American Style</i> (New York and Washington, D.C.: Harry N. Abrams, Inc., in association with the National Museum of American Art, 1998)</p>",""
"282","Artist Biography","<p>Printmaker, painter.  While still a young boy, Baumann emigrated with his family from Magdeburg, Germany, to Chicago.  He returned to Germany to study at Kunstgewerbeschule in Munich and later attended the Art Institute of Chicago.  After moving to Santa Fe in 1918, he became a leading member of the art community, respected for services he performed on behalf of his colleagues and for his experiments in a wide variety of media.  Baumann was appointed area coordinator of the Public Works of Art Project of the Works Progress Administration beginning in the early 1930s.  During this time, he also carved and decorated a large number of marionettes, with which he and his wife and other artists toured the state, acting out Hispanic and Indian folk stories.  In 1939, he published <i>Frijoles Canyon Pictographs,</i> illustrated with woodblock prints of prehistoric Indian designs and figures carved in the canyon walls.  Later he incorporated such anthropological imagery into his art.</p><br /><p>References<br />Baumann, Gustave. "At Work on Taos and Rio Pictures."  <i>El Palacio</i> 6 (January 1919): 47.</p><p>Cassidy, Ina Sizer.  "Art and Artists of New Mexico." <i>New Mexico Magazine</i> 10 (October 19320: 24.</p><p>Garoffolo, Vincent.  "The Woodblock art of Gustave Baumann."  In <i>New Mexico Artists, New Mexico Artist Series No. 3,</i> pp. 35&#8211;44.  Albuquerque: University of New Mexico Press, 1952.</p><p>Charles Eldredge, Julie Schimmel, and William H. Truettner <i>Art in New Mexico, 1900&#8211;1945: Paths to Taos and Santa Fe</i> (Washington, DC: National Museum of American Art, Smithsonian Institution, 1986)</p>",""
"286","Artist Biography","<p>Painter. A first generation New York Abstract Expressionist. Marine life is suggested by the titles Baziotes selected for many of his paintings, which showed the Surrealist influences of Joan Mir&#243; and Andr&#233; Masson in the use of biomorphic shapes. The artist exhibited his paintings widely in national and international exhibitions.</p><p>Joan Stahl <i>American Artists in Photographic Portraits from the Peter A. Juley & Son Collection</i> (Washington, D.C. and Mineola, New York: National Museum of American Art and Dover Publications, Inc., 1995)</p>","Primary"
"286","Artist Biography","<p>Born 11 June 1912, Pittsburgh.   Family moved to Reading, Pa., 1913. Worked for stained-glass company about 1931&ndash;32.  Moved to New York, 1933.  Studied with Leon Kroll at theNational Academy of Design, 1933&ndash;36. Taught for the Works Progress Administration/FederalArt Project, 1936&ndash;38. 1938&ndash;40 worked on WPA Easel Painting Project.  1941, married Ethel Copstein.  1944, first one-man show at Peggy Guggenheim's Art of This Century gallery, New York. 1948, founded  Subjects of the Artist school with David Hare, Robert Motherwell, Barnett Newman, Mark Rothko.  1949&ndash;52, taught at Brooklyn Museum Art School and New York University; 1950&ndash;52, at Museum of Modern Art; 1952&ndash;62, at Hunter College, New York.  Died  6 June 1963, New York City.</p><p>William Kloss <i>Treasures from the National Museum of American Art</i> (Washington, D.C. and London: National Museum of American Art with the Smithsonian Institution Press, 1985)</p>",""
"288","Artist Biography","<p>Painter and etcher, an American Impressionist who studied with William Merritt Chase.  He painted romantic scenes of New York City, the circus and New England landscapes.</p><p>Joan Stahl <i>American Artists in Photographic Portraits from the Peter A. Juley & Son Collection</i> (Washington, D.C. and Mineola, New York: National Museum of American Art and Dover Publications, Inc., 1995)</p>",""
"289","Artist Biography","<p>An Abstract Expressionist when he left the Art Institute of Chicago in 1956, Beal has since become a dedicated realist who sees art as a potentially powerful moral force. He has great regard for Platonic ideals of truth, beauty, and goodness, and admires both the realism of seventeenth-century Dutch painting and the compositional authority of Renaissance art. Since moving to New York in the late 1950s with his wife, painter Sondra Freckelton, Beal has painted still lifes, portraits, and landscapes, although in recent years his most ambitious undertakings have been large-scale allegories and myths. In describing his approach, Beal calls himself a "life painter" and says he is committed to human over aesthetic concerns. Yet his intricate complexes of figures and surface patterns, along with his adroit handling of space, reveal his sophisticated, accomplished sense of composition.</p><p>Virginia M. Mecklenburg <i>Modern American Realism: The Sara Roby Foundation Collection</i> (Washington, D.C.: Smithsonian Institution Press for the National Museum of American Art, 1987)</p>",""
"2195","Artist Biography","<p>Born in Dayton, Ohio, 1950.  Currently resides in Pittsford, New York.  Hess's work has been exhibited at the International Museum of Photography at George Eastman House in Rochester, New York, the Contemporary Arts Center in New Orleans, Louisiana, and in Boston's Institute of Contemporary Art.  He has received a National Endowment for the Arts Fellowship.</p><p>Merry A. Foresta, Stephen Jay Gould, and Karal Ann Marling <i>Between Home and Heaven: Contemporary American Landscape Photography</i> (Washington, D.C. and Albuquerque, New Mexico: The National Museum of American Art in association with the University of New Mexico Press, 1992)</p>",""
"291","Artist Biography","<p>During his childhood in Chicago, Illinois, Lester Beall's mother encouraged him to draw as a means of creative expression and as a diversion from their family's difficult financial situation. In 1917 Beall began attending Saturday art classes at the Art Institute of Chicago, where his youthful efforts received high praise. Beall continued to draw during high school, his course work including four years of mechanical drawing classes. This early grounding in technical drawing became an important element of his developing graphic style.</p><p>Beall enrolled at the University of Chicago as a science major, but ultimately switched to the art history program. Because the school offered no studio courses at that time, Beall supplemented his art history classes with additional life drawing and painting classes at the Art Institute. Upon graduation from the university in 1926, Beall found work as a freelance illustrator in Chicago. During the difficult years of the Depression, Beall continued to take studio art classes at the Art Institute. In addition to the classes, he spent a great deal of time at the museum's library, where he reveled in the avant garde graphic design of French art magazines. </p><p>Exposure to these very modern representations of art, typography, and illustration dramatically changed Beall's artistic vision. He incorporated these influences into his own advertising designs to create the dynamic graphic style for which he is remembered today. The Museum of Modern Art recognized Beall's achievements in 1937 with a solo exhibition, the first time a graphic designer was so honored.</p><p>Therese Thau Heyman <i>Posters American Style</i> (New York and Washington, D.C.: Harry N. Abrams, Inc., in association with the National Museum of American Art, 1998)</p>",""
"299","Artist Biography","<p>Robert Beauchamp studied with Boardman Robinson at the Colorado Springs Fine Arts Center and attended Cranbrook Academy of Art before working with Abstract Expressionist Hans Hofmann. In 1953 he gave up abstract art, believing it to be too esoteric and remote from immediate life, and returned to painting the figure. Beauchamp's approach, however, was to "distort, fantasize and pile in the images ... to paint objects with the subtleties of natural forms and the subjectivity possible through abstraction." In the decades after he began exhibiting, Beauchamp received several grants, traveled to Rome on a Fulbright fellowship (1959), and held several teaching positions. A New York resident in his later years, Beauchamp exhibited regularly and painted fanciful, sometimes horrific, scenes in which "reality" provided as important a source of inspiration as did the imagination.</p><p>Virginia M. Mecklenburg <i>Modern American Realism: The Sara Roby Foundation Collection</i> (Washington, D.C.: Smithsonian Institution Press for the National Museum of American Art, 1987)</p>",""
"300","Artist Biography","<p>Born Philadelphia, 1855. Before 1872, studied drawing with Dutch artist Adolf van der Whelen. 1875, fossil drawings on commission from U.S. Geological Survey. 1877&ndash;79, studied Pennsylvania Academy of the Fine Arts. First exhibited 1879. 1888, studied at Académie Julian, Paris. Worked in Concarneaux, Brittany; traveled in Italy. 1889, returned to Philadelphia. 1893, elected to Society of American Artists. 1895-1915, taught at the Pennsylvania Academy of the Fine Arts. 1896, France and England; exhibited at Champs-de-Mars, Paris. 1898, Gold Medal of Honor from Pennsylvania Academy. From 1899, a prominent portrait artist with many distinguished commissions and exhibitions. Virtually ceased painting after 1930. 1935, largest lifetime exhibition, American Academy of Arts and Letters. Died 7 September 1942, Gloucester, Mass.</p><p>William Kloss <i>Treasures from the National Museum of American Art</i> (Washington, D.C. and London: National Museum of American Art with the Smithsonian Institution Press, 1985)</p>",""
"301","Artist Biography","<p>Bay Area painter Robert Bechtle was born in San Francisco and studied art and design at the California College of Arts and Crafts in Oakland and the University of California at Berkeley. Although he began his painting career by exploring Abstract Expressionism, Bay Area figuration, and Pop Art, it was his concurrent experiments with photography that led Bechtle to start painting from photographs in an effort to forge a visual style distinct from that of his early influences&mdash;artists such as Richard Diebenkorn and Nathan Oliveira.</p>
