"ConstituentID","TextType","BioDsp","PrimaryBio"
"206","Artist Biography","<p>Saul Baizerman was awarded a scholarship to the Imperial Art School in Odessa on the strength of his first work in clay. In 1910 he immigrated to the United States, locating briefly in Boston before settling permanently in New York City. There he studied art at the National Academy of Design and subsequently enrolled at the Beaux-Arts Institute of Design as its first sculpture student. In 1920 Baizerman won a public competition to create a Civil Liberty monument for Grant's Tomb in New York but rejected the coveted commission to pursue the possibilities of hammered metal, a technique he discovered while working on small cast bronzes. Intrigued by the transitory effects of light and shadow on hammered metal surfaces, Baizerman executed "City and the People," his first series using the technique in hammered bronze. By 1921 he had started to work in hammered copper, which remained his preferred medium.</p><p>During the twenties Baizerman traveled frequently to Europe, lured by the need to prepare for a 1924 solo exhibition in London, as well as by the artistic and architectural treasures of France, Russia, and Italy. In 1931, however, the loss of almost all his art in a fire that demolished his studio effectively put an end to Baizerman's transatlantic journeys. Two years later, salvaging what he could from the ruins of his workshop, the artist presented his first American solo exhibition, featuring small bronzes from the twenties, at New York's Eighth Street Gallery. From 1934 to 1940 he conducted sculpture, drawing, and anatomy classes at his own art institute, the Baizerman Art School. After 1940, although he continued to teach at the American Artists School and the University of Southern California, Baizerman's energy primarily was directed to his own work.</p><p><i>National Museum of American Art</i> (CD-ROM) (New York and Washington D.C.: MacMillan Digital in cooperation with the National Museum of American Art, 1996)</p>",""
"207","Artist Biography","<p>Bryant Baker studied in London at the City and Guild Technical Institute and the Royal Academy of Arts. His decorative carvings and sculpture were installed at Westminster Abbey and other cathedrals. In 1916 he moved to the United States and served in the army, working to rehabilitate American veterans from World War I by modeling artificial limbs. Baker won commissions for busts of five presidents, including John F. Kennedy. He also made bronze and marble statues of other political figures such as Abraham Lincoln and Henry Cabot Lodge. He was a Fellow of the National Sculpture Society, the Royal Society of British Sculptors, and a life member of St. George's Society.</p><p><i>National Museum of American Art</i> (CD-ROM) (New York and Washington D.C.: MacMillan Digital in cooperation with the National Museum of American Art, 1996)</p>",""
"1257","Artist Biography","<p>Miniaturist Daniel Dickinson was the son of the amateur portrait painter Oliver Dickinson, Jr. and the younger brother of Anson Dickinson, who achieved more fame painting miniatures than did his brother. Daniel Dickinson is believed to have studied in New Haven, Connecticut, about 1812. Toward the end of that decade he moved to Philadelphia, where he painted miniatures and portraits until 1846. The following year Dickinson moved to nearby Camden, New Jersey, and as time passed he abandoned his career as a portrait painter and devoted himself to horticulture.</p><p><i>National Museum of American Art</i> (CD-ROM) (New York and Washington D.C.: MacMillan Digital in cooperation with the National Museum of American Art, 1996)</p>",""
"211","Artist Biography","<p>Born in London, Robert Peter Baker came from a family of sculptors and carvers. At age ten he began studying at the Lambeth School of Art and continued at the City and Guilds Technical Institute; this was followed by five years at the Royal Academy of Arts. At twenty-one he was working for sculptor Adrian Jones on the architectural sculpture for the top of the memorial arch to Inigo Jones in Hyde Park. His ability to model portraits and the figure won him a medal at the Royal Academy in 1911. A pacifist, he came to America to avoid military service at the outbreak of World War I and remained the rest of his life. Initially he established a studio in Boston, where he hired as an assistant young  Donald De Lue and supported himself through portraits and commissions for architectural sculpture. Baker's main interest, however, was figurative sculpture of imaginative subjects in a romantic, symbolist vein similar to the work of the French sculptor Auguste Rodin. During the 1920s he worked in Paris and New York City, then moved in 1929 to Woods Hole, Massachusetts, where he died in 1940.</p><p><i>National Museum of American Art</i> (CD-ROM) (New York and Washington D.C.: MacMillan Digital in cooperation with the National Museum of American Art, 1996)</p>",""
"218","Artist Biography","<p>Ball rose to prominence as the growing United States sought to commemorate its civic heroes in public spaces as well as in the home. Although he is best known for his larger-than-life equestrian statue of George Washington in the Boston Public Garden, Ball was also one of the first American sculptors to patent and cast in bronze affordable domestic statuary. He made a career of portraying statesmen and historical figures, rendered in a naturalistic style somewhere between the inexpensive, moralizing sculpture groups cast in plaster by John Rogers and the high-style neoclassical marbles of Thomas Crawford and Hiram Powers. Ball was born in Charlestown, Massachusetts. The son of a house and sign painter, he served a brief apprenticeship with the Boston engraver Abel Brown before opening his own studio as a miniaturist and portrait painter. Soon after, Ball gave up his easel, distracted by a romantic disappointment and, according to legend, transferred his attention to a lump of clay. He found his calling and relocated to Italy. Although Ball made periodic trips back to the states, and his work was included in such major exhibitions as the 1893 World's Columbian Exposition in Chicago, he remained an expatriate until 1897, when he moved to Montclair, New Jersey.</p><p>William H. Truettner and Roger B. Stein, editors, with contributions by Dona Brown, Thomas Andrew Denenberg, Judith K. Maxwell, Stephen Nissenbaum, Bruce Robertson, Roger B. Stein, and William H. Truettner <i>Picturing Old New England: Image and Memory</i> (Washington, D.C.; New Haven, Conn; and London: National Museum of American Art with Yale University Press, 1999)> (Washington, D.C.; New Haven, Conn; and London: National Museum of American Art with Yale University Press, 1999)</p>",""
"226","Artist Biography","<p>Bannister created a sensation when one of his paintings won first prize at the Philadelphia Centennial Exposition in 1876. He was also a respected and knowledgeable art critic.</p><p><i>Paintings by African Americans from the collection of the National Museum of American Art: A Book of Postcards</i> (Washington, D.C.: National Museum of American Art in cooperation with Pomegranate Artbooks, 1991)</p>","Primary"
"226","Artist Biography","<p>"All that I would do I cannot&#151;that is, all I could say in art &#151;simply from lack of training, but with God's help I hope to deliver the message he entrusted to me."  George W. Whitaker, "Reminiscences of Providence Artists," <i>Providence Magazine, The Board of Trade Journal</i> (Feb. 1914): 139.</p><br /><p>Edward Mitchell Bannister's determination to become a successful artist was largely fueled by an inflammatory article he read in the <i>New York Herald</i> in 1867, that stated "the Negro seems to have an appreciation for art while being manifestly unable to produce it." Ironically, less than a decade later, in 1876, Bannister was the first African-American artist to receive a national award.</p><p>Bannister was born in November 1828 in St. Andrews, New Brunswick, Canada. His father was a native of Barbados, West Indies. The racial identity of Bannister's mother, Hannah Alexander Bannister, who lived in New Brunswick and whom Bannister credited with fostering his earliest artistic interests, is not known. Bannister's father apparently died early, and after the death of his mother in 1844 he lived with a white family in New Brunswick. Bannister left his foster home after several years and took a job at sea, as was customary for many young men from St. Andrews.</p><p>In 1848 Bannister moved to Boston where he held a variety of menial jobs before he became a barber and eventually learned to paint. Bannister painted in the Boston Studio Building, and also enrolled inseveral evening classes at Lowell Institute with the noted sculptor-anatomist Dr. William Rimmer.  Only a few of Bannister's paintings from the 1850s and 1860s have survived, preventing a stylistic assessment of his early period in Boston. While Bannister lived in Boston he must have seen and been influenced by the Barbizon School-inspired paintings of  William Morris Hunt who had studied in Europe and held numerous public exhibitions in Boston during the 1860s. American landscape painters were increasingly aware of the simple rustic motifs and pictorial poetry of French Barbizon paintings by Jean-Baptiste Corot, Jean-Fran&ccedil;ois Millet, and Charles-Fran&#231;ois Daubigny in the midnineteenth century.</p><p>On June 10, 1857, Bannister marriedChristiana Cartreaux, a Narragansett Indian who was born in North Kingston, Rhode Island. The couple had no children. Christiana worked as a wigmaker and hairdresser in Boston, and her Rhode Island background might have prompted the Bannisters to move from Boston to Providence, Rhode Island, in 1870.</p><p>Since Bannister's artistic studies were limited, it is remarkable, indeed, that within five years after his arrival in Providence, one of Bannister's paintings was accepted in thePhiladelphia Centennial Exposition of 1876. The painting, <i>Under the Oaks</i>, was selected for the first-prize bronze medal. Bannister related in considerable detail that the judges became indignant and originally wanted to "reconsider" the award upon discovering that Bannister was African American. The white competitors, however, upheld the decision and Bannister was awarded the bronze medal. The location of the painting has not been known since the turn of the century. </p><p>Following the Centennial Exposition, Bannister's reputation grew and numerous commissions enabled him to devote all his time to painting. He executed a large number of landscapes, most of which depict quiet, bucolic scenes rendered in somber tones and thick impasto. While Bannister'sinitial influence probably stemmed from the Barbizon-inspired works of William Morris Hunt, his paintings are reflective of an artist who loved the quiet beauties of nature and represented them in a realistic manner. Bannister's middle-period landscapes of the 1870s were generally executed in broad masses of heavy impasto with few details. They also evoke a tranquil mood that became one of the hallmarks of Bannister's style. Later landscapes of the 1880s and 1890s employed a more gentleimpasto and loosely applied broken color similar to impressionist techniques.</p><p>Many of Bannister's landscapes are small and have darkened considerably with age. His paintings contain no social or racial overtones, and the small figures seen frequently in his landscapes appear to be white. Although the majority of Bannister's paintings are landscapes, he also painted figure studies, religious scenes, seascapes, still lifes, and genre subjects. Bannister was attracted primarily to picturesque motifs including cottages, castles, cattle, dawns, sunsets, and small bodies of water, and he portrayed nature as a calm and submissive force in his works.</p><p>In spite of his limited training and experience, Bannister was among Providence's leading painters during the 1870s and 1880s. He was well liked and respected by his fellow citizens. On January 9, 1901, Bannister died while attending a prayer meeting at his church.  Shortly after his death, the Providence Art Club mounted a memorial exhibition of 101 of Bannister's paintings owned by Providence collectors. Bannister's grave in North Burial Ground, Providence, is marked by a rough granite boulder ten feet high bearing a carving of a palette with the artist's name and a pipe. A bronze plaque also adorns the monument and is inscribed with a poem, which reads in part, "This pure and lofty soul . . . who, while he portrayed nature, walked with God."  Edward M. Bannister was the only major African-American artist of the late nineteenth century who developed his talents without the benefit of European exposure.</p><p>Regenia A. Perry <i>Free within Ourselves: African-American Artists in the Collection of the National Museum of American Art</i> (Washington, D.C.: National Museum of American Art in Association with Pomegranate Art Books, 1992)</p>",""
"240","Artist Biography","<p>Born in Bellefonte, Pennsylvania, George Grey Barnard began his art studies at the School of the Art Institute of Chicago in 1882. The following year he went to France, where he remainedfor more than ten years, studying at the &Eacute;cole des Beaux Arts from 1884 to 1887. Barnard's work was stronglyinfluenced by that of the French master Auguste Rodin. Using the nude to signify themes such as love and the relationship between nature and humankind, Barnard worked primarily in stone. In 1894 his sculpture won acclaim at the salon of the Societ&eacute; Nationale des Beaux-Arts in Paris. Soon afterward he returned to the United States and settled in New York City.</p><p>From 1900 to 1904 he taught at the Art Students League while continuing to exhibit his work internationally and to execute numerous commissions. In 1902 he was commissioned to create sculptures for the Pennsylvania State Capitol in Harrisburg&mdash;the largest such commission awarded to an American up to that time. The project, consisting of more than sixty figures representing the history of humankind, occupied Barnard for eight years and made him famous. Among his other commissions was a series of statues of Abraham Lincoln for several cities.</p><p>Barnard was also renowned for his collection of medieval art, which became the basis of the Cloisters at the Metropolitan Museum of Art. A second collection amassed by Barnard was soldby his estate to the Philadelphia Museum of Art. Barnard spent his last years working on an antiwar monument entitled <i>Rainbow Arch,</i> which was left uncompleted upon his death in New York City in 1938.</p><p><i>National Museum of American Art</i> (CD-ROM) (New York and Washington D.C.: MacMillan Digital in cooperation with the National Museum of American Art, 1996)</p>",""
"240","Artist Biography","<p>One of the most original sculptors of his day, he gained prominence at the Paris Salon in 1894 with <i>Struggle of the Two Natures.</i> His vast collection of medieval sculpture eventually formed the core of the collection of the Cloisters in New York City.</p><p>Joan Stahl <i>American Artists in Photographic Portraits from the Peter A. Juley & Son Collection</i> (Washington, D.C. and Mineola, New York: National Museum of American Art and Dover Publications, Inc., 1995)</p>","Primary"
"1690","Artist Biography","<p>Miniaturist Sarah Carter Frothingham was the daughter of the portrait painter James Frothingham. Most of her work was done in New York between 1837 and 1845 and was exhibited at Boston Atheneum and the National Academy of Design, which named her an associate in 1841. Frothingham died in New York City in 1861.</p><p><i>National Museum of American Art</i> (CD-ROM) (New York and Washington D.C.: MacMillan Digital in cooperation with the National Museum of American Art, 1996)</p>",""
"1960","Artist Biography","<p>Born in Austria, Gross studied in Budapest and Vienna before settling in the United States in 1921. Gross sculpted in wood, using a direct carving technique. He is best known for his semi-abstract interpretations of the human form.</p><p>Joan Stahl <i>American Artists in Photographic Portraits from the Peter A. Juley & Son Collection</i> (Washington, D.C. and Mineola, New York: National Museum of American Art and Dover Publications, Inc., 1995)</p>","Primary"
"241","Artist Biography","<p>A well-known daguerrean artist in Oswego, New York, George N. Barnard had opened a photography studio in Syracuse by 1854.  He subsequently became affiliated with Mathew Brady's gallery in Washington, D.C., and photographed Lincoln's inauguration in 1861.  As an official Union Army photographer during the Civil War, he was given two mules, a covered wagon, and an African-American driver to follow several military campaigns, most notably General William Tecumseh' Sherman's famous march in 1864 from Chattanooga to Atlanta.  His reminisces of General Sherman, Ulysses S. Grant, and Joseph Hooker made interesting reading for patrons of <i>Harper's Weekly, Leslie's,</i> and other contemporary periodicals and were illustrated by line engravings of his photographs.  Prompted by the success of Alexander Gardener's <i>Photographic Sketchbook of the War,</i> Barnard published <i>Photographic Views of Sherman's Campaign</i> in 1866.  Including sixty-one photographs, a small volume of historical text, and several official campaign maps, the album weighed twenty pounds and sold for one hundred dollars.</p><p>Barnard made at least three photographs of the area around New Hope, Georgia, after the week-long battle in May 1864 between General Joseph Johnston's southern forces and Sherman's troops.  He often focused on broken trees and ravaged ground, as well as other melancholy views, such as the Jones Memorial on the grounds of Bonaventure Plantation near Savannah.  Barnard's album presents a complex symbolic picture of the appalling looses suffered in this national conflict.</p><p>Merry A. Foresta <i>American Photographs: The First Century</i> (Washington, D.C.: National Museum of American Art with the Smithsonian Institution Press, 1996)</p>",""
"245","Artist Biography","<p>Painter and printmaker, teacher at the Art Students League. Barnet's images of women and domestic scenes, distinctive in their emphasis on flat painting surfaces, are meditative in tone.</p><p>Joan Stahl <i>American Artists in Photographic Portraits from the Peter A. Juley & Son Collection</i> (Washington, D.C. and Mineola, New York: National Museum of American Art and Dover Publications, Inc., 1995)</p>","Primary"
"245","Artist Biography","<p>Between 1927 and 1930 Barnet studied at the School of the Museum of Fine Arts in Boston, and in the mid 1930s he taught in New York at the Art Students League and the New School for Social Research. Throughout his career Barnet has been a figurative artist, although in the late 1940s he experimented with eliminating realistic space and began using semiabstract forms to convey what he felt were substances and forces in nature. In the mid 1950s, he reduced his images to simple pictographs, although basic human shapes could still be discerned. Around 1960, however, he became dissatisfied with his attempts to unite human and abstract forms, and sought a fresh approach. Starting in 1962, when he exhibited a new series of paintings that reasserted the human figure as his primary subject matter, Barnet has continued to explore themes of meditation and human relationships.</p><p>Virginia M. Mecklenburg <i>Modern American Realism: The Sara Roby Foundation Collection</i> (Washington, D.C.: Smithsonian Institution Press for the National Museum of American Art, 1987)</p>",""
"247","Artist Biography","<p>Born in Cincinnati, lived in various places, including Paris, Washington, D.C., and Hollywood.  Artist, playwright, patron of the arts.  Her Studio House in Washington, D.C., the scene of many cultural salons, 1903&#150;1925, is now owned by the NMAA.</p><p>Charles Sullivan, ed <i>American Beauties: Women in Art and Literature</i> (New York: Henry N. Abrams, Inc., in association with National Museum of American Art, 1993)</p>","Primary"
"247","Artist Biography","<p>Defying social and family expectations, the wealthy, often eccentric Alice Pike Barney (1857&ndash;1931) zestfully committed herself to the arts and became known for her lively art salons, bohemian lifestyle, and unusual family.</p><p>Alice and her counterparts in other cities represented a new social type: women who lived proper upper-class lives but did not follow the rules, using their wealth and privilege to buy themselves freedoms and to promote causes the rich did not customarily embrace.  As an artist, writer, theater director, philanthropist, civic leader, and patron of the arts, Alice moved in the turn-of-the-century artistic circles of Paris, London, and Washington, D.C.</p><p>Throughout Alice's life, which often seemed a dramatic play of her own writing, she encoutered a brilliant cast of characters: among them Oscar Wilde, James McNeill Whistler, and the legendary explorer Henry Morton Stanley, whose impassioned offer of marriage she rejected.  Her easygoing personality and charming wit dazzled the artistic circles she traversed with such ease, winning the freindship of Anna Pavlova, Ara Bernhardt, Ruth St. Denis, and Emma Calv&eacute;, among many others.</p><p>Shortly after she turned nineteen, Alice accepted the marriage proposal of Gilded Age-industrialist Albert Clifford Barney.  Throughout their married life, Albert encouraged Alice to work at her social position rather than her artistic pursuits.  Her stubborn refusal to compromise her ideals infuriated him and led to continuous conflict.  They led separate lives for much of their marriage, Albert eventually drinking himself into an early grave, while Alice raised their two daughters, Natalie and Laura, and established her salon in Europe and the United States.</p><p>Alice began seriously painting during the Barneys' first trip to Paris in 1883, studing with Charles &Eacute;mile Auguste Carolus-Duran, a master portrait painter.  She continued painting on her return to the United States, winning accolates and a congressional commission, that shocked Washington society, who found it unseemly that a woman of wealth and social standing would paint at all.  She pursued the arts all her life, exhibiting a rare versatility between the fine arts and the performing arts.  After Albert's death, and during her subsequent marriage to Christian Hemmick, a man thirty years her junior, Alice devoted herself to the arts and converting Washington, D.C., from a cultural backwater to a true capital of the arts.</p><p>Among her other accomplishments, Alice designed and built what was considered an anomaly in her time, a studio house intended to provide a focus for the arts and artists of Washington, D.C.  The Studio House, as she called it, became the base for her manipulation of Washington culture.  However, foremost in Alice's intentions in building Studio House, was her desire to show others how to live artistically.  To this day, Studio House exists as one of the few extant examples of a turn-of-the-century artist's studio residence.</p><p>Jean L. Kling <i>Alice Pike Barney: Her Life and Art</i> (Washington, D.C. and London: National Museum of American Art in cooperation with Smithsonian Institution Press, 1994)</p>",""
"249","Artist Biography","<p>Tina Barney was born to a wealthy New York family in 1945. She began collecting photographs in 1971, which sparked her interest in doing her own work. In 1976 she and her husband moved to Sun Valley, Idaho, where she took photography classes at the local art center. During the 1980s Barney developed her photographic vision, focusing on the comfortable lives of the social elite; as a member of this class herself, she is able to photograph friends and family in intimate social settings usually unseen by the outside world. Barney's work is characterized by rich colors and deep focus, achieved through controlled lighting, that capture the material details of the lives of her subjects. Barney lives in New York City and Watch Hill, Rhode Island.</p><p><i>National Museum of American Art</i> (CD-ROM) (New York and Washington D.C.: MacMillan Digital in cooperation with the National Museum of American Art, 1996)</p>",""
"250","Artist Biography","<p>Born in Germany, Hannelore Baron immigrated to the United States in 1941 and settled in New York City. As Jews in Nazi Germany, the family suffered persecution and the destruction of their home before finally being able to come to America. The traumatic experiences of this period in Baron's life would directly influence her artwork. Using found fragments of wood, paper, and memorabilia, she began to make collages and assemblages in the 1950s. Her first exhibition took place in 1969 and was followed by numerous gallery shows in New York and Europe. Reporting her death in 1987, the <I>New York Times</I> stated: "She had a special feeling for paper, for the weight of communication it can bear and the weight of history that settles so easily on its edges and surfaces. &#133; She used letters as symbols of memory and birds as symbols of vulnerability and the need for song."</p><p><i>National Museum of American Art</i> (CD-ROM) (New York and Washington D.C.: MacMillan Digital in cooperation with the National Museum of American Art, 1996)</p>",""
